id,name,nameDisplay,description,abv,styleId,isOrganic,status,statusDisplay,createDate,updateDate,style/id,style/categoryId,style/category/id,style/category/name,style/category/createDate,style/name,style/shortName,style/description,style/ibuMin,style/ibuMax,style/abvMin,style/abvMax,style/srmMin,style/srmMax,style/ogMin,style/fgMin,style/fgMax,style/createDate,style/updateDate,availableId,foodPairings,available/id,available/name,available/description,ibu,glasswareId,srmId,labels/icon,labels/medium,labels/large,servingTemperature,servingTemperatureDisplay,originalGravity,glass/id,glass/name,glass/createDate,srm/id,srm/name,srm/hex,year
DOc9Bw,'Heifer' Weizen,'Heifer' Weizen,,5.2,48,N,verified,Verified,2012-04-15 19:46:36,2015-01-21 17:53:54,48,4,4,German Origin Ales,2012-03-21 20:06:46,South German-Style Hefeweizen / Hefeweissbier,Hefeweizen,"The aroma and flavor of a Weissbier with yeast is decidedly fruity and phenolic. The phenolic characteristics are often described as clove-, nutmeg-like, mildly smoke-like or even vanilla-like. Banana-like esters should be present at low to medium-high levels. These beers are made with at least 50 percent malted wheat, and hop rates are quite low. Hop flavor and aroma are absent or present at very low levels. Weissbier is well attenuated and very highly carbonated and a medium to full bodied beer. The color is very pale to pale amber. Because yeast is present, the beer will have yeast flavor and a characteristically fuller mouthfeel and may be appropriately very cloudy. No diacetyl should be perceived.",10,15,4.9,5.5,3,9,1.047,1.008,1.016,2012-03-21 20:06:46,2015-04-07 15:29:27,,,,,,,9,,,,,,,,9,Weizen,2012-01-03 02:41:33,,,,
35lHUq,'Inappropriate' Cream Ale,'Inappropriate' Cream Ale,"So named for the lack of family-friendly names that our employees came up with for this beer. As Porter’s 8-year-old son would say, “They were all ‘Inappropriate’.” A preprohibition style cream ale that uses a solid proportion of flaked corn in the malt as was typical of that time period. With a light bready aroma and light body, it is refreshing for a hot Summer day. To ferment, we used an ale/lager hybrid yeast strain that finishes crisp to quench your thirst. Also, as its clarity reveals, it is one of our few filtered beers.",5.3,109,N,verified,Verified,2013-08-13 01:40:44,2015-06-17 20:09:21,109,11,11,Hybrid/mixed Beer,2012-03-21 20:06:46,American-Style Cream Ale or Lager,Cream Ale,"Mild, pale, light-bodied ale, made using a warm fermentation (top or bottom) and cold lagering. Hop bitterness and flavor range from very low to low. Hop aroma is often absent. Sometimes referred to as cream ales, these beers are crisp and refreshing. Pale malt character predominates. Caramelized malt character should be absent. A fruity or estery aroma may be perceived. Diacetyl and chill haze should not be perceived. Sulfur character and/or sweet corn-like dimethylsulfide (DMS) should be extremely low or absent from this style of beer.",10,22,4.2,5.6,2,5,1.044,1.004,1.01,2012-03-21 20:06:46,2015-04-07 15:42:30,6,,6,Summer,Available during the summer months.,18,5,5,,,,cold,Cold - (4-7C/39-45F),1.048,5,Pint,2012-01-03 02:41:33,5,5,FBB123,
JUfNjz,'lil Butler Blue,'lil Butler Blue,"Our 5th Double Berliner weiss with bluberries, kettle soured.",,46,N,verified,Verified,2015-08-07 17:20:45,2015-08-07 17:20:45,46,4,4,German Origin Ales,2012-03-21 20:06:46,Berliner-Style Weisse (Wheat),Berlinerweisse,"This is very pale in color and the lightest of all the German wheat beers. The unique combination of yeast and lactic acid bacteria fermentation yields a beer that is acidic, highly attenuated, and very light bodied. The carbonation of a Berliner Weisse is high, and hop rates are very low. Clarity may be hazy or cloudy from yeast or chill haze. Hop character should not be perceived. Fruity esters will be evident. No diacetyl should be perceived.",3,6,2.8,3.4,2,4,1.028,1.004,1.006,2012-03-21 20:06:46,2015-04-07 15:29:14,,,,,,,,,,,,,,,,,,,,,
ZQzj1u,'Lil Griz,'Lil Griz,"Deliberately blazing our own trail, we brewed this barrel aged brown ale believing there is room for a new craft beer category: “Sessionable Bourbon Barrel Aged Beers”. Weighing in at 6.8% ABV ( Alc. 6.8% by Vol. ), the rich chocolate notes & creaminess of the flaked oats easily justify this beer bringing home a FoBAB medal this year. We hope you enjoy the ‘Lil Griz.",6.8,37,N,verified,Verified,2015-02-25 14:30:03,2015-12-17 22:55:35,37,3,3,North American Origin Ales,2012-03-21 20:06:45,American-Style Brown Ale,American Brown,"American brown ales range from deep copper to brown in color. Roasted malt caramel-like and chocolate-like characters should be of medium intensity in both flavor and aroma. American brown ales have evident low to medium hop flavor and aroma, medium to high hop bitterness, and a medium body. Estery and fruity-ester characters should be subdued. Diacetyl should not be perceived. Chill haze is allowable at cold temperatures.",25,45,4,6.4,15,26,1.04,1.01,1.018,2012-03-21 20:06:46,2015-04-07 15:27:35,,,,,,34,,,https://s3.amazonaws.com/brewerydbapi/beer/ZQzj1u/upload_0hoJ8r-icon.png,https://s3.amazonaws.com/brewerydbapi/beer/ZQzj1u/upload_0hoJ8r-medium.png,https://s3.amazonaws.com/brewerydbapi/beer/ZQzj1u/upload_0hoJ8r-large.png,,,,,,,,,,
7WoDkH,'Merican,'Merican,,5.8,32,N,verified,Verified,2013-11-01 12:36:31,2015-12-17 06:41:04,32,3,3,North American Origin Ales,2012-03-21 20:06:45,American-Style Amber/Red Ale,Amber,"American amber/red ales range from light copper to light brown in color. They are characterized by American-variety hops used to produce the perception of medium hop bitterness, flavor, and medium aroma. Amber ales have medium-high to high maltiness with medium to low caramel character. They should have medium to medium-high body. The style may have low levels of fruityester flavor and aroma. Diacetyl can be either absent or barely perceived at very low levels. Chill haze is allowable at cold temperatures. Slight yeast haze is acceptable for bottle-conditioned products.",30,40,4.5,6,11,18,1.048,1.012,1.018,2012-03-21 20:06:45,2015-04-07 15:26:52,,,,,,,5,,https://s3.amazonaws.com/brewerydbapi/beer/7WoDkH/upload_JsZsYY-icon.png,https://s3.amazonaws.com/brewerydbapi/beer/7WoDkH/upload_JsZsYY-medium.png,https://s3.amazonaws.com/brewerydbapi/beer/7WoDkH/upload_JsZsYY-large.png,,,,5,Pint,2012-01-03 02:41:33,,,,
bRGRZj,'Merican Wheat,'Merican Wheat,,5.6,112,N,verified,Verified,2015-08-19 15:30:33,2015-08-19 20:38:38,112,11,11,Hybrid/mixed Beer,2012-03-21 20:06:46,Light American Wheat Ale or Lager with Yeast,Wheat Ale,"This beer can be made using either ale or lager yeast. It can be brewed with 30 to 75 percent wheat malt, and hop rates may be low to medium. Hop characters may be light to moderate in bitterness, flavor and aroma. Fruity-estery aroma and flavor are typical but at low levels however, phenolic, clove-like characteristics should not be perceived. Color is usually straw to light amber, and the body should be light to medium in character. Diacetyl should not be perceived. Because this style is served with yeast the character should portray a full yeasty mouthfeel and appear hazy to very cloudy. Chill haze is also acceptable. Yeast flavor and aroma should be low to medium but not overpowering the balance and character of malt and hops. These beers are typically served with the yeast in the bottle, and are cloudy when served.",10,35,3.5,5.5,4,10,1.036,1.006,1.018,2012-03-21 20:06:46,2015-04-07 15:42:48,,,,,,,,,,,,,,,,,,,,,
r9lPS8,'Murican Brown Rye,'Murican Brown Rye,,6,117,N,verified,Verified,2014-11-04 18:25:34,2014-11-04 18:25:34,117,11,11,Hybrid/mixed Beer,2012-03-21 20:06:46,Rye Ale or Lager with or without Yeast,Rye Ale,"Rye beers can be made using either ale or lager yeast. It should be brewed with at least 20 percent rye malt, and low to medium perception of hop bitterness. Hop aroma and flavor can be low to medium-high. These are often versions of classic styles that contain noticeable rye character in balance with other qualities of the beer. A spicy, fruity-estery aroma and flavor are typical but at low levels; however, phenolic, clove-like characteristics should not be perceived. Color is straw to amber, and the body should be light to medium in character. Diacetyl should not be perceived. If this style is packaged and served without yeast, no yeast characters should be evident in mouthfeel, flavor, or aroma. A low level of tannin derived astringency may be perceived. If this style is served with yeast, the character should portray a full yeasty mouthfeel and appear hazy to very cloudy. Yeast flavor and aroma should be low to medium but not overpowering the balance and character of rye and barley malt and hops. Darker versions of this style will be dark amber to dark brown, and the body should be light to medium in character. Roasted malts are optionally evident in aroma and flavor with a low level of roast malt astringency acceptable when appropriately balanced with malt sweetness. Roast malts may be evident as a cocoa/chocolate or caramel character. Aromatic toffee-like, caramel, or biscuit-like characters may be part of the overall flavor/aroma profile. As in the lighter colored versions, diacetyl should not be perceived. Competition directors may create specific styles of rye beer, such as Rye Pale Ale or Rye Brown Ale. A statement by the brewer indicating if the beer is based on a classic style is essential for accurate judging.",,,,,,,,,,2012-03-21 20:06:46,2015-04-07 15:44:12,,,,,,,,,,,,,,,,,,,,,
c4f2KE,'Murican Pilsner,'Murican Pilsner,,5.5,98,N,verified,Verified,2013-08-19 11:58:12,2015-12-17 06:02:53,98,8,8,North American Lager,2012-03-21 20:06:46,American-Style Pilsener,American Pilsener,"This classic and unique pre-Prohibition American-style Pilsener is straw to deep gold in color. Hop bitterness, flavor and aroma are medium to high, and use of noble-type hops for flavor and aroma is preferred. Up to 25 percent corn and/or rice in the grist should be used. Malt flavor and aroma are medium. This is a light-medium to medium-bodied beer. Sweet corn-like dimethylsulfide (DMS), fruity esters and American hop-derived citrus flavors or aromas should not be perceived. Diacetyl is not acceptable. There should be no chill haze. Competition organizers may wish to subcategorize this style into rice and corn subcategories.",25,40,5,6,3,6,1.045,1.012,1.018,2012-03-21 20:06:46,2015-04-07 15:40:08,,,,,,,4,,https://s3.amazonaws.com/brewerydbapi/beer/c4f2KE/upload_jjKJ7g-icon.png,https://s3.amazonaws.com/brewerydbapi/beer/c4f2KE/upload_jjKJ7g-medium.png,https://s3.amazonaws.com/brewerydbapi/beer/c4f2KE/upload_jjKJ7g-large.png,,,,4,Pilsner,2012-01-03 02:41:33,,,,
EPLPz5,'n Toeback,'n Toeback,"'n Toeback is a top fermenting 'Kempense Quattro'.
Legend says that after drinking a toeback quattro one of the 'Wildemannen' takes the Sint-Katharina church of Hoogstraten out for a walk. He can carry a 105 meter tower, weighing 100 metric tons on his back! A magic beer, that 'toeback'!",9.5,63,N,verified,Verified,2012-11-06 12:28:06,2015-12-16 19:40:08,63,5,5,Belgian And French Origin Ales,2012-03-21 20:06:46,Belgian-Style Pale Strong Ale,Belgian Pale Strong,"Belgian pale strong ales are pale to golden in color with relatively light body for a beer of its alcoholic strength. Often brewed with light colored Belgian ""candy"" sugar, these beers are well attenuated. The perception of hop bitterness is medium-low to medium -high, with hop flavor and aroma also in this range. These beers are highly attenuated and have a perceptively deceiving high alcoholic character-being light to medium bodied rather than full bodied. The intensity of malt character should be low to medium, often surviving along with a complex fruitiness. Very little or no diacetyl is perceived. Herbs and spices are sometimes used to delicately flavor these strong ales. Low levels of phenolic spiciness from yeast byproducts may also be perceived. Chill haze is allowable at cold temperatures.",20,50,7,11,4,10,1.064,1.012,1.024,2012-03-21 20:06:46,2015-04-07 15:32:16,,,,,,,,,https://s3.amazonaws.com/brewerydbapi/beer/EPLPz5/upload_WLs95w-icon.png,https://s3.amazonaws.com/brewerydbapi/beer/EPLPz5/upload_WLs95w-medium.png,https://s3.amazonaws.com/brewerydbapi/beer/EPLPz5/upload_WLs95w-large.png,,,,,,,,,,
IkRF2B,'Nother Day in Paradise,'Nother Day in Paradise,,,125,N,verified,Verified,2012-03-30 12:27:35,2015-12-16 16:13:22,125,11,11,Hybrid/mixed Beer,2012-03-21 20:06:46,Specialty Beer,Specialty,"These beers are brewed using unusual fermentable sugars, grains and starches that contribute to alcohol content other than, or in addition to, malted barley. Nuts generally have some degree of fermentables, thus beers brewed with nuts would appropriately be entered in this category. The distinctive characters of these special ingredients should be evident either in the aroma, flavor or overall balance of the beer, but not necessarily in overpowering quantities. For example, maple syrup or potatoes would be considered unusual. Rice, corn, or wheat are not considered unusual. Special ingredients must be listed when competing. A statement by the brewer explaining the special nature of the beer, ingredient(s) and achieved character is essential in order for fair assessment in competitions. If this beer is a classic style with some specialty ingredient(s), the brewer should also specify the classic style. Guidelines for competing: Spiced beers using unusual fermentables should be entered in the experimental category. Fruit beers using unusual fermentables should be entered in the fruit beer category.",,100,2.5,25,1,100,1.03,1.006,1.03,2012-03-21 20:06:46,2015-04-07 15:44:53,3,,3,Not Available,Beer is not available.,,,,https://s3.amazonaws.com/brewerydbapi/beer/IkRF2B/upload_pe8G4j-icon.png,https://s3.amazonaws.com/brewerydbapi/beer/IkRF2B/upload_pe8G4j-medium.png,https://s3.amazonaws.com/brewerydbapi/beer/IkRF2B/upload_pe8G4j-large.png,,,,,,,,,,
pxM9nM,'Ol Blackie IPA,'Ol Blackie IPA,,6.6,41,N,verified,Verified,2012-12-14 11:46:56,2012-12-14 11:46:56,41,3,3,North American Origin Ales,2012-03-21 20:06:45,American-Style Black Ale,Black Ale,"American-style Black Ales are very dark to black and perceived to have medium high to high hop bitterness, flavor and aroma with medium-high alcohol content, balanced with a medium body. Fruity, floral and herbal character from hops of all origins may contribute character. The style is further characterized by a balanced and moderate degree of caramel malt and dark roasted malt flavor and aroma. High astringency and high degree of burnt roast malt character should be absent.",50,70,6,7.5,35,35,1.056,1.012,1.018,2012-03-21 20:06:46,2015-04-07 15:28:36,4,,4,Seasonal,"Available at the same time of year, every year.",76,5,,,,,,,,5,Pint,2012-01-03 02:41:33,,,,
BjmFMX,'Scott's Addition' India Pale Ale,'Scott's Addition' India Pale Ale,"Finally an Isley IPA.... You will fall in love with this hoppy brew that comes through at 90 IBU's. The nose is piney with a hint of citrus, and the medium body and caramel maltiness are a refreshing change from your typical IPA. This ale crosses the line and tears through the stereotypes. … Give it a shot",7.5,30,N,verified,Verified,2014-07-04 13:01:31,2014-07-04 13:01:31,30,3,3,North American Origin Ales,2012-03-21 20:06:45,American-Style India Pale Ale,American IPA,"American-style India pale ales are perceived to have medium-high to intense hop bitterness, flavor and aroma with medium-high alcohol content. The style is further characterized by floral, fruity, citrus-like, piney, resinous, or sulfur-like American-variety hop character. Note that one or more of these American-variety hop characters is the perceived end, but the hop characters may be a result of the skillful use of hops of other national origins. The use of water with high mineral content results in a crisp, dry beer. This pale gold to deep copper-colored ale has a full, flowery hop aroma and may have a strong hop flavor (in addition to the perception of hop bitterness). India pale ales possess medium maltiness which contributes to a medium body. Fruity-ester flavors and aromas are moderate to very strong. Diacetyl can be absent or may be perceived at very low levels. Chill and/or hop haze is allowable at cold temperatures. (English and citrus-like American hops are considered enough of a distinction justifying separate American-style IPA and English-style IPA categories or subcategories. Hops of other origins may be used for bitterness or approximating traditional American or English character. See English-style India Pale Ale",50,70,6.3,7.5,6,14,1.06,1.012,1.018,2012-03-21 20:06:45,2015-04-07 15:26:37,,,,,,90,,,,,,,,,,,,,,,
i51yaD,'t Smisje Kirst,'t Smisje Kirst,,11,64,N,verified,Verified,2014-07-14 19:55:57,2015-12-17 15:18:38,64,5,5,Belgian And French Origin Ales,2012-03-21 20:06:46,Belgian-Style Dark Strong Ale,Belgian Dark Strong,"Belgian dark strong ales are amber to dark brown in color. Often, though not always, brewed with dark Belgian ""candy"" sugar, these beers can be well attenuated, ranging from medium to full-bodied. The perception of hop bitterness is low to medium, with hop flavor and aroma also in this range. Fruity complexity along with the soft flavors of roasted malts add distinct character. The alcohol strength of these beers can often be deceiving to the senses. The intensity of malt character can be rich, creamy, and sweet with intensities ranging from medium to high. Very little or no diacetyl is perceived. Herbs and spices are sometimes used to delicately flavor these strong ales. Low levels of phenolic spiciness from yeast byproducts may also be perceived. Chill haze is allowable at cold temperatures.",20,50,7,11,9,35,1.064,1.012,1.024,2012-03-21 20:06:46,2015-04-07 15:32:23,,,,,,,,,https://s3.amazonaws.com/brewerydbapi/beer/i51yaD/upload_1WsEQd-icon.png,https://s3.amazonaws.com/brewerydbapi/beer/i51yaD/upload_1WsEQd-medium.png,https://s3.amazonaws.com/brewerydbapi/beer/i51yaD/upload_1WsEQd-large.png,,,,,,,,,,
qbRV90,'tis the Saison,'tis the Saison,A Saison brewed with rye malt and three types of peppercorn.  This is Bart’s first NoDable Series brew so come out and enjoy!,7,72,N,verified,Verified,2012-04-11 01:58:50,2015-12-16 16:20:18,72,5,5,Belgian And French Origin Ales,2012-03-21 20:06:46,French & Belgian-Style Saison,Saison,"Beers in this category are golden to deep amber in color. There may be quite a variety of characters within this style. Generally: They are light to medium in body. Malt aroma is low to medium-low. Esters are medium to high in  aroma, while, complex alcohols, herbs, spices, low Brettanomyces character and even clove and smoke-like phenolics may or may not be evident in the overall balanced beer. Hop aroma and flavor may be at low to medium levels. Malt flavor is low but provides foundation for the overall balance. Hop bitterness is moderate to moderately assertive. Herb and/or spice flavors, including black pepper-like notes, may or may not be evident. Fruitiness from fermentation is generally in character. A balanced small amount of sour or acidic flavors is acceptable when in balance with other components. Earthy, cellar-like, musty aromas are okay. Diacetyl should not be perceived. Chill or slight yeast haze is okay. Often bottle conditioned with some yeast character and high carbonation. French & Belgian-Style Saison may have Brettanomyces characters that are slightly acidity, fruity, horsey, goaty and/or leather-like.",20,40,4.5,8.5,4,14,1.055,1.004,1.016,2012-03-21 20:06:46,2015-04-07 15:34:55,2,,2,Limited,Limited availability.,30,5,7,https://s3.amazonaws.com/brewerydbapi/beer/qbRV90/upload_OhEPYR-icon.png,https://s3.amazonaws.com/brewerydbapi/beer/qbRV90/upload_OhEPYR-medium.png,https://s3.amazonaws.com/brewerydbapi/beer/qbRV90/upload_OhEPYR-large.png,,,,5,Pint,2012-01-03 02:41:33,7,7,F39C00,
SUt3fh,'Too Nice Yams','Too Nice Yams',"Sweet Potato Ale...our version of a Pumpkin Ale. 

We are Southerners, and what Southerner doesn't like sweet potatoes?

Sweet potatoes are baked till they begin to carmelize and are added directly to the mash.

This brew should remind you of a pumpkin pie. Spiced with just a touch of fall spices that do not overpower, brings this brew to be a fall favorite.

We also add pure maple syrup to compliment the sweet/caramel malt base, and finish off with vanilla extract.

The aroma and taste of Fall!",,121,N,verified,Verified,2015-03-11 23:28:26,2015-09-22 14:45:18,121,11,11,Hybrid/mixed Beer,2012-03-21 20:06:46,Pumpkin Beer,Pumpkin Beer,"Pumpkin beers are any beers using pumpkins (Cucurbito pepo) as an adjunct in either mash, kettle, primary or secondary fermentation, providing obvious (ranging from subtle to intense), yet harmonious, qualities. Pumpkin qualities should not be overpowered by hop character. These may or may not be spiced or flavored with other things. A statement by the brewer explaining the nature of the beer is essential for fair assessment in competitions. If this beer is a classic style with pumpkin, the brewer should also specify the classic style.",5,70,2.5,12,5,50,1.03,1.006,1.03,2012-03-21 20:06:46,2015-04-07 15:44:28,7,,7,Fall,Available during the fall months.,,,,,,,,,,,,,,,,
o3V3Vy,'Venus Fly Trap' Imperial IPA,'Venus Fly Trap' Imperial IPA,"When the brewers at Isley Brewing Company and Original Gravity teamed up to craft an Imperial IPA,  we set out to make a beer that would showcase  our favorite hop flavors and aromas.  We used Citra, Centennial and Mosaic to create a beer  that is delightfully hoppy and surprisingly drinkable  for a beer of it's strength without getting into palate wrecking territory.  Venus Flytrap Imperial IPA will lure you in with a complex blend of hop aromas  once you get a taste....well,  you might not be going anywhere anytime soon.",8.5,31,N,verified,Verified,2014-07-04 13:01:57,2014-07-04 13:01:57,31,3,3,North American Origin Ales,2012-03-21 20:06:45,Imperial or Double India Pale Ale,Imperial IPA,"Imperial or Double India Pale Ales have intense hop bitterness, flavor and aroma. Alcohol content is medium-high to high and notably evident. They range from deep golden to medium copper in color. The style may use any variety of hops. Though the hop character is intense it's balanced with complex alcohol flavors, moderate to high fruity esters and medium to high malt character. Hop character should be fresh and lively and should not be harsh in quality. The use of large amounts of hops may cause a degree of appropriate hop haze. Imperial or Double India Pale Ales have medium-high to full body. Diacetyl should not be perceived. The intention of this style of beer is to exhibit the fresh and bright character of hops. Oxidative character and aged character should not be present.",65,100,7.5,10.5,5,13,1.075,1.012,1.02,2012-03-21 20:06:45,2015-04-07 15:26:46,,,,,,70,,,,,,,,,,,,,,,
QNDrfP,'You Had Me At Hello' Hefeweizen,'You Had Me At Hello' Hefeweizen,"This Hefeweizen will have your taste buds in love at hello, goodbye, and every sip in between  This wheat beer has gentle hints of banana and clove  with a sweet malty flavor. It will grab you on the first sip and you won't want to say goodbye",5.2,48,N,verified,Verified,2014-07-04 13:02:17,2015-06-18 17:51:56,48,4,4,German Origin Ales,2012-03-21 20:06:46,South German-Style Hefeweizen / Hefeweissbier,Hefeweizen,"The aroma and flavor of a Weissbier with yeast is decidedly fruity and phenolic. The phenolic characteristics are often described as clove-, nutmeg-like, mildly smoke-like or even vanilla-like. Banana-like esters should be present at low to medium-high levels. These beers are made with at least 50 percent malted wheat, and hop rates are quite low. Hop flavor and aroma are absent or present at very low levels. Weissbier is well attenuated and very highly carbonated and a medium to full bodied beer. The color is very pale to pale amber. Because yeast is present, the beer will have yeast flavor and a characteristically fuller mouthfeel and may be appropriately very cloudy. No diacetyl should be perceived.",10,15,4.9,5.5,3,9,1.047,1.008,1.016,2012-03-21 20:06:46,2015-04-07 15:29:27,,,,,,16,,,,,,,,,,,,,,,
qhaIVA,(306) URBAN WHEAT BEER,(306) URBAN WHEAT BEER,"A classic from Southern Germany with fruity banana notes and clove aroma. Featuring a slightly red hue from the Saskatchewan Red Wheat used. The wheat adds a soft, creamy, texture to refresh you.",5,65,N,verified,Verified,2016-05-05 16:52:57,2016-05-05 17:01:03,65,5,5,Belgian And French Origin Ales,2012-03-21 20:06:46,Belgian-Style White (or Wit) / Belgian-Style Wheat,Witbier,Belgian white ales are very pale in color and are brewed using unmalted wheat and malted barley and are spiced with coriander and orange peel. Coriander and light orange peel aroma should be perceived as such or as an unidentified spiciness. Phenolic spiciness and yeast flavors may be evident at mild levels. These beers are traditionally bottle conditioned and served cloudy. An unfiltered starch and yeast haze should be part of the appearance. The low to medium body should have some degree of creaminess from wheat starch. The style is further characterized by the use of noble-type hops to achieve low hop bitterness and little to no apparent hop flavor. This beer has no diacetyl and a low to medium fruity-ester level. Mild acidity is appropriate.,10,17,4.8,5.2,2,4,1.044,1.006,1.01,2012-03-21 20:06:46,2015-04-07 15:32:30,1,,1,Year Round,Available year round as a staple beer.,20,,9,,,,cold,Cold - (4-7C/39-45F),,,,,9,9,E58500,
