id,name,nameDisplay,description,abv,styleId,isOrganic,status,statusDisplay,createDate,updateDate,style/id,style/categoryId,style/category/id,style/category/name,style/category/createDate,style/name,style/shortName,style/description,style/ibuMin,style/ibuMax,style/abvMin,style/abvMax,style/srmMin,style/srmMax,style/ogMin,style/fgMin,style/fgMax,style/createDate,style/updateDate,availableId,foodPairings,available/id,available/name,available/description,ibu,glasswareId,srmId,labels/icon,labels/medium,labels/large,servingTemperature,servingTemperatureDisplay,originalGravity,glass/id,glass/name,glass/createDate,srm/id,srm/name,srm/hex,year
GMWSAD,(401) India Pale Ale,(401) India Pale Ale,,,30,N,verified,Verified,2013-07-22 23:17:15,2015-12-17 04:43:34,30,3,3,North American Origin Ales,2012-03-21 20:06:45,American-Style India Pale Ale,American IPA,"American-style India pale ales are perceived to have medium-high to intense hop bitterness, flavor and aroma with medium-high alcohol content. The style is further characterized by floral, fruity, citrus-like, piney, resinous, or sulfur-like American-variety hop character. Note that one or more of these American-variety hop characters is the perceived end, but the hop characters may be a result of the skillful use of hops of other national origins. The use of water with high mineral content results in a crisp, dry beer. This pale gold to deep copper-colored ale has a full, flowery hop aroma and may have a strong hop flavor (in addition to the perception of hop bitterness). India pale ales possess medium maltiness which contributes to a medium body. Fruity-ester flavors and aromas are moderate to very strong. Diacetyl can be absent or may be perceived at very low levels. Chill and/or hop haze is allowable at cold temperatures. (English and citrus-like American hops are considered enough of a distinction justifying separate American-style IPA and English-style IPA categories or subcategories. Hops of other origins may be used for bitterness or approximating traditional American or English character. See English-style India Pale Ale",50,70,6.3,7.5,6,14,1.06,1.012,1.018,2012-03-21 20:06:45,2015-04-07 15:26:37,,,,,,,,,https://s3.amazonaws.com/brewerydbapi/beer/GMWSAD/upload_3dlRGl-icon.png,https://s3.amazonaws.com/brewerydbapi/beer/GMWSAD/upload_3dlRGl-medium.png,https://s3.amazonaws.com/brewerydbapi/beer/GMWSAD/upload_3dlRGl-large.png,,,,,,,,,,
rCr5op,(416) Local Lager,(416) Local Lager,"Brewed for our home town, the city of Toronto! This beer uses all natural ingredients to create a light citrus aroma and a clean, crisp, refreshing taste.",4.16,93,N,verified,Verified,2015-03-30 17:41:24,2016-01-04 19:48:26,93,8,8,North American Lager,2012-03-21 20:06:46,American-Style Lager,American Lager,"Light in body and very light to straw in color, American lagers are very clean and crisp and aggressively carbonated. Flavor components should b e subtle and complex, with no one ingredient dominating the others. Malt sweetness is light to mild. Corn, rice, or other grain or sugar adjuncts are often used. Hop bitterness, flavor and aroma are negligible to very light. Light fruity esters are acceptable. Chill haze and diacetyl should be absent.",5,13,3.8,5,2,4,1.04,1.006,1.01,2012-03-21 20:06:46,2015-04-07 15:39:26,1,,1,Year Round,Available year round as a staple beer.,15,,,,,,cold,Cold - (4-7C/39-45F),,,,,,,,
tciJOF,(512) ALT,(512) ALT,"(512) ALT is a German-style amber ale that is fermented cooler than typical ales and cold conditioned like a lager. ALT means ""old"" in German and refers to a beer style made using ale yeast after many German brewers had switched to newly discovered lager yeast. This ale has a very smooth, yet pronounced, hop bitterness with a malty backbone and a characteristic German yeast character. Made with 98% Organic 2-row and Munch malts and US noble hops.",6,55,N,verified,Verified,2012-01-03 02:42:36,2015-12-16 05:20:58,55,4,4,German Origin Ales,2012-03-21 20:06:46,German-Style Altbier,Altbier,"German-Style Altbiers are copper to dark brown ales, originally from the Düsseldorf area. No chill haze should be perceived. A variety of malts including wheat may be used to produce medium-low to medium malt aroma. Fruityester aroma can be low. No diacetyl aroma should be perceived. Hop aroma is low to medium. A variety of malts including wheat may be used to produce medium-low to medium level malty flavor. Hop flavor is low to medium. Hop bitterness is medium to very high (although the 25 to 35 IBU range is more normal for the majority of Altbiers from Düsseldorf). Fruity-ester flavors can be low. No diacetyl should be perceived. The overall impression is clean, crisp, and flavorful often with a dry finish. Body is medium.",25,52,4.3,5.5,11,19,1.044,1.008,1.014,2012-03-21 20:06:46,2015-04-07 17:08:31,5,,5,Spring,Available during the spring months.,36,5,21,https://s3.amazonaws.com/brewerydbapi/beer/tciJOF/upload_cdbSIJ-icon.png,https://s3.amazonaws.com/brewerydbapi/beer/tciJOF/upload_cdbSIJ-medium.png,https://s3.amazonaws.com/brewerydbapi/beer/tciJOF/upload_cdbSIJ-large.png,cold,Cold - (4-7C/39-45F),,5,Pint,2012-01-03 02:41:33,21,21,952D00,
6PPnT2,(512) Black IPA,(512) Black IPA,"An entirely new creation from organic 2-row, organic Crystal 60 and Carafa III, a huskless black malt that gives this beer it’s black color with notes of coffee and chicory without any tannic bitterness. The hop additions are many and generous, featuring Apollo, Horizon, and Nugget, clocking the beer in at 70 IBU. Over 11 pounds per batch of Nugget hops are added directly to the fermenter yielding a resiny herbal and spicy aroma. A hybrid style for dark beer fans who love hops.",7.5,125,N,verified,Verified,2012-01-03 02:42:36,2015-12-16 07:13:40,125,11,11,Hybrid/mixed Beer,2012-03-21 20:06:46,Specialty Beer,Specialty,"These beers are brewed using unusual fermentable sugars, grains and starches that contribute to alcohol content other than, or in addition to, malted barley. Nuts generally have some degree of fermentables, thus beers brewed with nuts would appropriately be entered in this category. The distinctive characters of these special ingredients should be evident either in the aroma, flavor or overall balance of the beer, but not necessarily in overpowering quantities. For example, maple syrup or potatoes would be considered unusual. Rice, corn, or wheat are not considered unusual. Special ingredients must be listed when competing. A statement by the brewer explaining the special nature of the beer, ingredient(s) and achieved character is essential in order for fair assessment in competitions. If this beer is a classic style with some specialty ingredient(s), the brewer should also specify the classic style. Guidelines for competing: Spiced beers using unusual fermentables should be entered in the experimental category. Fruit beers using unusual fermentables should be entered in the fruit beer category.",,100,2.5,25,1,100,1.03,1.006,1.03,2012-03-21 20:06:46,2015-04-07 15:44:53,5,,5,Spring,Available during the spring months.,70,5,41,https://s3.amazonaws.com/brewerydbapi/beer/6PPnT2/upload_Cnl1UJ-icon.png,https://s3.amazonaws.com/brewerydbapi/beer/6PPnT2/upload_Cnl1UJ-medium.png,https://s3.amazonaws.com/brewerydbapi/beer/6PPnT2/upload_Cnl1UJ-large.png,cold,Cold - (4-7C/39-45F),,5,Pint,2012-01-03 02:41:33,41,Over 40,000000,
VwR7Xg,(512) Bruin (A.K.A. Brown Bear),(512) Bruin (A.K.A. Brown Bear),"At once cuddly and ferocious, (512) BRUIN combines a smooth, rich maltiness and mahogany color with a solid hop backbone and stealthy 7.6% alcohol. Made with Organic 2 Row and Munich malts, plus Chocolate and Crystal malts, domestic hops, and a touch of molasses, this brew has notes of raisins, dark sugars, and cocoa, and pairs perfectly with food and the crisp fall air.",7.6,37,N,verified,Verified,2012-01-03 02:42:36,2015-12-16 05:30:35,37,3,3,North American Origin Ales,2012-03-21 20:06:45,American-Style Brown Ale,American Brown,"American brown ales range from deep copper to brown in color. Roasted malt caramel-like and chocolate-like characters should be of medium intensity in both flavor and aroma. American brown ales have evident low to medium hop flavor and aroma, medium to high hop bitterness, and a medium body. Estery and fruity-ester characters should be subdued. Diacetyl should not be perceived. Chill haze is allowable at cold temperatures.",25,45,4,6.4,15,26,1.04,1.01,1.018,2012-03-21 20:06:46,2015-04-07 15:27:35,7,,7,Fall,Available during the fall months.,30,5,21,https://s3.amazonaws.com/brewerydbapi/beer/VwR7Xg/upload_MiNs9j-icon.png,https://s3.amazonaws.com/brewerydbapi/beer/VwR7Xg/upload_MiNs9j-medium.png,https://s3.amazonaws.com/brewerydbapi/beer/VwR7Xg/upload_MiNs9j-large.png,cold,Cold - (4-7C/39-45F),,5,Pint,2012-01-03 02:41:33,21,21,952D00,
SqP18Z,(512) Cascabel Cream Stout,(512) Cascabel Cream Stout,"Smooth and roasty, and black as night, (512) Cascabel Cream Stout is brewed to a hair under 6% abv using almost 90% Organic Two Row and Crystal Malts, Chocolate Malt, and Roasted Barley. Non-fermentable Brewers Lactose is added for lasting sweetness, and over 20 pounds of Guajillo Chiles are added to warm you up when the night gets “chile”.",6,20,N,verified,Verified,2012-01-03 02:42:36,2015-12-16 06:24:47,20,1,1,British Origin Ales,2012-03-21 20:06:45,Sweet or Cream Stout,Sweet Stout,"Sweet stouts, also referred to as cream stouts, have less roasted bitter flavor and a full-bodied mouthfeel. The style can be given more body with milk sugar (lactose) before bottling. Malt sweetness, chocolate, and caramel flavor should dominate the flavor profile and contribute to the aroma. Hops should balance and suppress some of the sweetness without contributing apparent flavor or aroma. The overall impression should be sweet and full-bodied.",15,25,3,6,40,40,1.045,1.012,1.02,2012-03-21 20:06:45,2015-04-07 15:24:41,8,,8,Winter,Available during the winter months.,20,5,41,https://s3.amazonaws.com/brewerydbapi/beer/SqP18Z/upload_8FxcuW-icon.png,https://s3.amazonaws.com/brewerydbapi/beer/SqP18Z/upload_8FxcuW-medium.png,https://s3.amazonaws.com/brewerydbapi/beer/SqP18Z/upload_8FxcuW-large.png,cool,Cool - (8-12C/45-54F),,5,Pint,2012-01-03 02:41:33,41,Over 40,000000,
SV7JCk,(512) FIVE,(512) FIVE,"(512) FIVE is the culmination of our experience thus far and features a lineup of some of our favorite ingredients. Organic American two-row and English Maris Otter malts lay the foundation, while a generous dose of English roasted barley, black malt and chocolate malt create layers of roasty, dark complexity. American and Belgian crystal malts give balance and depth to the roasted character. Multiple additions of UK Fuggle hops impart an earthy, spicy finish to this deep, dark Imperial Stout.",10.1,43,N,verified,Verified,2015-06-19 16:03:18,2015-12-18 02:19:48,43,3,3,North American Origin Ales,2012-03-21 20:06:45,American-Style Imperial Stout,American Imperial Stout,"Black in color, American-style imperial stouts typically have a high alcohol content. Generally characterized as very robust. The extremely rich malty flavor and aroma are balanced with assertive hopping and fruity-ester characteristics. Bitterness should be moderately high to very high and balanced with full sweet malt character. Roasted malt astringency and bitterness can be moderately perceived but should not overwhelm the overall character. Hop aroma is usually moderately-high to overwhelmingly hop-floral, -citrus or -herbal. Diacetyl (butterscotch) levels should be absent.",50,80,7,12,40,40,1.08,1.02,1.03,2012-03-21 20:06:46,2015-04-07 15:28:49,8,,8,Winter,Available during the winter months.,45,6,41,https://s3.amazonaws.com/brewerydbapi/beer/SV7JCk/upload_RNljF3-icon.png,https://s3.amazonaws.com/brewerydbapi/beer/SV7JCk/upload_RNljF3-medium.png,https://s3.amazonaws.com/brewerydbapi/beer/SV7JCk/upload_RNljF3-large.png,cool,Cool - (8-12C/45-54F),,6,Snifter,2012-01-03 02:41:33,41,Over 40,000000,
oJFZwK,(512) FOUR,(512) FOUR,"For our 4th anniversary, we turned to one of our greatest inspirations, the rich brewing tradition of Great Britain.

(512) FOUR is a classic English-style Strong Ale. The biscuity Maris Otter and caramelly Crystal malts contribute notes of toast, toffee, and dried fruits, which are perfectly balanced with a blend of authentic UK Fuggle and East Kent Golding hops. Dry-hopped with Northdown, (512) FOUR is a complex and satisfying ale.",7.5,14,N,verified,Verified,2013-10-07 22:14:45,2015-12-17 06:36:42,14,1,1,British Origin Ales,2012-03-21 20:06:45,Strong Ale,Strong Ale,"Light amber to mid-range brown in color, strong ales are medium to full bodied with a malty sweetness and may have low levels of roast malt character. Hop aroma should be minimal and flavor can vary from none to medium in character intensity. Fruity-ester flavors and aromas can contribute to the character of this ale. Bitterness should be minimal but evident and balanced with malt and/or caramel-like sweetness. Alcohol types can be varied and complex. A rich, often sweet and complex estery character may be evident. Very low levels of diacetyl are acceptable. Chill haze is acceptable at low temperatures. (This style may often be split into two categories, strong and very strong.)",30,65,7,11,8,21,1.06,1.014,1.04,2012-03-21 20:06:45,2015-04-07 15:21:05,2,,2,Limited,Limited availability.,35,5,8,https://s3.amazonaws.com/brewerydbapi/beer/oJFZwK/upload_B40pzO-icon.png,https://s3.amazonaws.com/brewerydbapi/beer/oJFZwK/upload_B40pzO-medium.png,https://s3.amazonaws.com/brewerydbapi/beer/oJFZwK/upload_B40pzO-large.png,cold,Cold - (4-7C/39-45F),,5,Pint,2012-01-03 02:41:33,8,8,EA8F00,
ezGh5N,(512) IPA,(512) IPA,"(512) India Pale Ale is a big, aggressively dry-hopped American IPA with smooth bitterness (~65 IBU) balanced by medium maltiness. Organic 2-row malted barley, loads of hops, and great Austin water create an ale with apricot and vanilla aromatics that lure you in for more.",7,30,N,verified,Verified,2012-01-03 02:42:36,2015-12-16 04:42:39,30,3,3,North American Origin Ales,2012-03-21 20:06:45,American-Style India Pale Ale,American IPA,"American-style India pale ales are perceived to have medium-high to intense hop bitterness, flavor and aroma with medium-high alcohol content. The style is further characterized by floral, fruity, citrus-like, piney, resinous, or sulfur-like American-variety hop character. Note that one or more of these American-variety hop characters is the perceived end, but the hop characters may be a result of the skillful use of hops of other national origins. The use of water with high mineral content results in a crisp, dry beer. This pale gold to deep copper-colored ale has a full, flowery hop aroma and may have a strong hop flavor (in addition to the perception of hop bitterness). India pale ales possess medium maltiness which contributes to a medium body. Fruity-ester flavors and aromas are moderate to very strong. Diacetyl can be absent or may be perceived at very low levels. Chill and/or hop haze is allowable at cold temperatures. (English and citrus-like American hops are considered enough of a distinction justifying separate American-style IPA and English-style IPA categories or subcategories. Hops of other origins may be used for bitterness or approximating traditional American or English character. See English-style India Pale Ale",50,70,6.3,7.5,6,14,1.06,1.012,1.018,2012-03-21 20:06:45,2015-04-07 15:26:37,1,,1,Year Round,Available year round as a staple beer.,65,5,8,https://s3.amazonaws.com/brewerydbapi/beer/ezGh5N/upload_r8SNni-icon.png,https://s3.amazonaws.com/brewerydbapi/beer/ezGh5N/upload_r8SNni-medium.png,https://s3.amazonaws.com/brewerydbapi/beer/ezGh5N/upload_r8SNni-large.png,cold,Cold - (4-7C/39-45F),,5,Pint,2012-01-03 02:41:33,8,8,EA8F00,
s8rdpK,(512) ONE,(512) ONE (2009),"Our first anniversary release is a Belgian-style strong ale that is amber in color, with a light to medium body. Subtle malt sweetness is balanced with just enough hops. Soft honey aromas lead the way into rich raisin and mildly spicy, cake-like flavors. Made with 80% Organic Malted Barley, Belgian Specialty grains, Forbidden Fruit yeast, domestic hops and Round Rock local wildflower honey, this beer’s strength can be deceiving.",8,63,N,verified,Verified,2012-01-13 20:15:42,2015-12-16 15:16:19,63,5,5,Belgian And French Origin Ales,2012-03-21 20:06:46,Belgian-Style Pale Strong Ale,Belgian Pale Strong,"Belgian pale strong ales are pale to golden in color with relatively light body for a beer of its alcoholic strength. Often brewed with light colored Belgian ""candy"" sugar, these beers are well attenuated. The perception of hop bitterness is medium-low to medium -high, with hop flavor and aroma also in this range. These beers are highly attenuated and have a perceptively deceiving high alcoholic character-being light to medium bodied rather than full bodied. The intensity of malt character should be low to medium, often surviving along with a complex fruitiness. Very little or no diacetyl is perceived. Herbs and spices are sometimes used to delicately flavor these strong ales. Low levels of phenolic spiciness from yeast byproducts may also be perceived. Chill haze is allowable at cold temperatures.",20,50,7,11,4,10,1.064,1.012,1.024,2012-03-21 20:06:46,2015-04-07 15:32:16,2,,2,Limited,Limited availability.,22,8,8,https://s3.amazonaws.com/brewerydbapi/beer/s8rdpK/upload_seL9LP-icon.png,https://s3.amazonaws.com/brewerydbapi/beer/s8rdpK/upload_seL9LP-medium.png,https://s3.amazonaws.com/brewerydbapi/beer/s8rdpK/upload_seL9LP-large.png,cold,Cold - (4-7C/39-45F),,8,Tulip,2012-01-03 02:41:33,8,8,EA8F00,2009
2fXsvw,(512) Pale,(512) Pale,"(512) Pale is a copper colored American Pale Ale that balances earthy hop bitterness and bright hop flavor with a rich malty body. Made with Organic 2-row malt and US grown hops like all (512) ales, this beer is refreshing and not to be missed.",6,25,N,verified,Verified,2012-01-03 02:42:36,2015-12-16 05:31:49,25,3,3,North American Origin Ales,2012-03-21 20:06:45,American-Style Pale Ale,American Pale,"American pale ales range from deep golden to copper in color. The style is characterized by fruity, floral and citrus-like American-variety hop character producing medium to medium-high hop bitterness, flavor, and aroma. Note that the ""traditional"" style of this beer has its origins with certain floral, fruity, citrus-like, piney, resinous, or sulfur-like American hop varietals. One or more of these hop characters is the perceived end, but the perceived hop characters may be a result of the skillful use of hops of other national origins. American pale ales have medium body and low to medium maltiness. Low caramel character is allowable. Fruity-ester flavor and aroma should be moderate to strong. Diacetyl should be absent or present at very low levels. Chill haze is allowable at cold temperatures.",30,42,4.5,5.6,6,14,1.044,1.008,1.014,2012-03-21 20:06:45,2015-04-07 15:25:18,1,,1,Year Round,Available year round as a staple beer.,30,5,7,https://s3.amazonaws.com/brewerydbapi/beer/2fXsvw/upload_c0Trtt-icon.png,https://s3.amazonaws.com/brewerydbapi/beer/2fXsvw/upload_c0Trtt-medium.png,https://s3.amazonaws.com/brewerydbapi/beer/2fXsvw/upload_c0Trtt-large.png,cold,Cold - (4-7C/39-45F),,5,Pint,2012-01-03 02:41:33,7,7,F39C00,
NZYBId,(512) Peach Sour,(512) Peach Sour (2014),"We produced Peach Sour using a sour mash technique. We encouraged the naturally occurring wild yeast and bacteria that come in with the organic barley and wheat to spontaneously ferment at warm temperatures over a three day period. Fermentation was completed in stainless and racked to a 1,000 gallon Foeder (large oak barrel) for aging. After being on the wood for two months, we added 200 pounds of fresh peaches and allowed it to age another 12 months before packaging it for you. We hope you enjoy!",6.2,136,N,verified,Verified,2014-10-28 13:32:24,2015-12-17 19:22:18,136,11,11,Hybrid/mixed Beer,2012-03-21 20:06:46,Wood- and Barrel-Aged Sour Beer,BBL Aged Sour,"A wood- or barrel-aged sour beer is any lager, ale or hybrid beer, either a traditional style or a unique experimental beer that has been aged for a period of time in a wooden barrel or in contact with wood and has developed a bacterial induced natural acidity. This beer is aged in wood with the intention of introducing the micro flora present in the wood. Sometimes wood aging is intended to impart the particularly unique character of the wood, but wood-aged is not necessarily synonymous with imparting wood-flavors. Wood character can be characterized as a complex blend of vanillin and unique wood character. Wood-derived character can also be characterized by flavors of the product that was in the barrel during prior use. These wood-derived flavors, if present in this style, can be very low in character and barely perceived or evident or assertive as wood-derived flavors. Any degree of woodderived flavors should be in balance with other beer character. Fruit and herb/spiced versions may take on the hue, flavors and aromas of added ingredients.  Usually bacteria and ""wild"" yeasts fermentation contributes complex esters and results in a dry to very dry beer. Ultimately a balance of flavor, aroma and mouthfeel are sought with the marriage of acidity, complex esters, and new beer with wood and/or barrel flavors. Beers in this style may or may not have Brettanomyces character.  Brewers when entering this category should specify type of barrel used and any other special treatment or ingredients used. Competition managers may create style subcategories to differentiate between high alcohol and low alcohol beers and very dark and lighter colored beer as well as for fruit beers and non-fruit beers. Competitions may develop guidelines requesting brewers to specify what kind of wood (new or used oak, other wood varieties). The brewer may be asked to explain the special nature (wood used, base beer style(s) and achieved character) of the beer.",,,,,,,,,,2012-03-21 20:06:46,2015-04-07 15:46:56,2,,2,Limited,Limited availability.,8,8,,https://s3.amazonaws.com/brewerydbapi/beer/NZYBId/upload_fZwIL9-icon.png,https://s3.amazonaws.com/brewerydbapi/beer/NZYBId/upload_fZwIL9-medium.png,https://s3.amazonaws.com/brewerydbapi/beer/NZYBId/upload_fZwIL9-large.png,cool,Cool - (8-12C/45-54F),,8,Tulip,2012-01-03 02:41:33,,,,2014
9O3QPg,(512) SIX,(512) SIX,"(512) SIX is a Belgian Style Dubbel with as many organic Belgian ingredients as possible. Castle Pale, Special B and Cara-Munich lend unique Belgian terrior based flavors of dark fruits like plum, raisin and chocolate. Candi sugar cranks the alcohol without increasing the body. This low hopped malty beast from the dungeons of (512) will make a cold day warmer and our 6th Anniversary event one for the books.",7.5,58,N,verified,Verified,2012-01-03 02:42:36,2015-12-16 05:41:29,58,5,5,Belgian And French Origin Ales,2012-03-21 20:06:46,Belgian-Style Dubbel,Belgian Dubbel,"This medium-bodied, red to dark brown colored ale has a malty sweetness and chocolate-like caramel aroma. A light hop flavor and/or aroma is acceptable. Dubbels are also characterized by low-medium to medium bitterness. No diacetyl is acceptable. Yeastgenerated fruity esters (especially banana) are appropriate at low levels. Head retention is dense and mousse-like. Chill haze is acceptable at low serving temperatures. Often bottle conditioned a slight yeast haze and flavor may be evident.",20,30,6.25,7.5,16,36,1.06,1.012,1.016,2012-03-21 20:06:46,2015-04-07 15:31:45,2,,2,Limited,Limited availability.,25,8,28,https://s3.amazonaws.com/brewerydbapi/beer/9O3QPg/upload_GIORHy-icon.png,https://s3.amazonaws.com/brewerydbapi/beer/9O3QPg/upload_GIORHy-medium.png,https://s3.amazonaws.com/brewerydbapi/beer/9O3QPg/upload_GIORHy-large.png,cool,Cool - (8-12C/45-54F),,8,Tulip,2012-01-03 02:41:33,28,28,6A0E00,
fcKbrl,(512) Stingo,(512) Stingo,,7.5,13,N,verified,Verified,2015-08-02 14:40:30,2015-08-02 14:40:30,13,1,1,British Origin Ales,2012-03-21 20:06:45,Old Ale,Old Ale,"Dark amber to brown in color, old ales are medium to full bodied with a malty sweetness. Hop aroma should be minimal and flavor can vary from none to medium in character intensity. Fruity-ester flavors and aromas can contribute to the character of this ale. Bitterness should be minimal but evident and balanced with malt and/or caramel-like sweetness. Alcohol types can be varied and complex. A distinctive quality of these ales is that they undergo an aging process (often for years) on their yeast either in bulk storage or through conditioning in the bottle, which contributes to a rich, wine-like and often sweet oxidation character. Complex estery characters may also emerge. Some very low diacetyl character may be evident and acceptable. Wood aged characters such as vanillin and other woody characters are acceptable. Horsey, goaty, leathery and phenolic character evolved from Brettanomyces organisms and acidity may be present but should be at low levels and balanced with other flavors Residual flavors that come from liquids previously aged in a barrel such as bourbon or sherry should not be present. Chill haze is acceptable at low temperatures. (This style may often be split into two categories, strong and very strong. Brettanomyces organisms and acidic characters reflect historical character. Competition organizers may choose to distinguish these types of old ale from modern versions.)",30,65,6,9,12,30,1.058,1.014,1.03,2012-03-21 20:06:45,2015-04-07 15:21:03,,,,,,35,,,,,,,,,,,,,,,
