id,name,nameDisplay,description,abv,ibu,glasswareId,availableId,styleId,isOrganic,labels/icon,labels/medium,labels/large,status,statusDisplay,originalGravity,createDate,updateDate,glass/id,glass/name,glass/createDate,available/id,available/name,available/description,style/id,style/categoryId,style/category/id,style/category/name,style/category/createDate,style/name,style/shortName,style/description,style/ibuMin,style/ibuMax,style/abvMin,style/abvMax,style/srmMin,style/srmMax,style/ogMin,style/fgMin,style/fgMax,style/createDate,style/updateDate,srmId,servingTemperature,servingTemperatureDisplay,srm/id,srm/name,srm/hex,year,foodPairings
Mnd972,18th Anniversary Wood Aged Double IPA,18th Anniversary Wood Aged Double IPA,"18th Anniversary Wood Aged Double IPA is a copper-hued treat in celebration of everything Great Divide does best. Plenty of malty sweetness provides a backdrop for earthy, floral English and American hops, while French and American oak round off the edges and provide a touch of vanilla. Thanks to everyone who’s supported us for the last 18 years—here’s to 18 more!",10,,,4,31,N,https://s3.amazonaws.com/brewerydbapi/beer/Mnd972/upload_MxCI12-icon.png,https://s3.amazonaws.com/brewerydbapi/beer/Mnd972/upload_MxCI12-medium.png,https://s3.amazonaws.com/brewerydbapi/beer/Mnd972/upload_MxCI12-large.png,verified,Verified,,2012-06-06 14:11:59,2015-12-16 16:53:48,,,,4,Seasonal,"Available at the same time of year, every year.",31,3,3,North American Origin Ales,2012-03-21 20:06:45,Imperial or Double India Pale Ale,Imperial IPA,"Imperial or Double India Pale Ales have intense hop bitterness, flavor and aroma. Alcohol content is medium-high to high and notably evident. They range from deep golden to medium copper in color. The style may use any variety of hops. Though the hop character is intense it's balanced with complex alcohol flavors, moderate to high fruity esters and medium to high malt character. Hop character should be fresh and lively and should not be harsh in quality. The use of large amounts of hops may cause a degree of appropriate hop haze. Imperial or Double India Pale Ales have medium-high to full body. Diacetyl should not be perceived. The intention of this style of beer is to exhibit the fresh and bright character of hops. Oxidative character and aged character should not be present.",65,100,7.5,10.5,5,13,1.075,1.012,1.02,2012-03-21 20:06:45,2015-04-07 15:26:46,,,,,,,,"Bacon & blue cheese hamburger, barbecue ribs, Point Reyes blue cheese, sticky toffee pudding, caramel cheesecake."
ZQGP3X,19 Anniversary Thunderstruck IPA,19 Anniversary Thunderstruck IPA,"Our 19th anniversary beer brings the boom, delivering it to the palate in a voluminous, hop-driven thunderclap backed by the power of our brewing passion and intensity. This double IPA owes its considerable oomph to a quartet of Australian hops—Topaz and Galaxy, plus newcomers Ella and Vic Secret. We also had Fairview malt shipped in from Australia just for this brew. The beer's striking tropical fruit, citrus and peach hop flavors and slightly resinous and aromatically dank earthiness are sure to electrify your senses.

We have many special beers planned for release to celebrate our 20 years of brewing, so let this serve as the first course to what will be an undoubtedly epic feast for craft beer enthusiasts, with particular thanks to those who've been with us for the long haul and helped us attain such longevity. Consider this the first of many Thank-Yous...for years to come!",9,,,,30,N,https://s3.amazonaws.com/brewerydbapi/beer/ZQGP3X/upload_3Cudwz-icon.png,https://s3.amazonaws.com/brewerydbapi/beer/ZQGP3X/upload_3Cudwz-medium.png,https://s3.amazonaws.com/brewerydbapi/beer/ZQGP3X/upload_3Cudwz-large.png,verified,Verified,,2015-08-26 13:50:39,2015-12-18 04:31:46,,,,,,,30,3,3,North American Origin Ales,2012-03-21 20:06:45,American-Style India Pale Ale,American IPA,"American-style India pale ales are perceived to have medium-high to intense hop bitterness, flavor and aroma with medium-high alcohol content. The style is further characterized by floral, fruity, citrus-like, piney, resinous, or sulfur-like American-variety hop character. Note that one or more of these American-variety hop characters is the perceived end, but the hop characters may be a result of the skillful use of hops of other national origins. The use of water with high mineral content results in a crisp, dry beer. This pale gold to deep copper-colored ale has a full, flowery hop aroma and may have a strong hop flavor (in addition to the perception of hop bitterness). India pale ales possess medium maltiness which contributes to a medium body. Fruity-ester flavors and aromas are moderate to very strong. Diacetyl can be absent or may be perceived at very low levels. Chill and/or hop haze is allowable at cold temperatures. (English and citrus-like American hops are considered enough of a distinction justifying separate American-style IPA and English-style IPA categories or subcategories. Hops of other origins may be used for bitterness or approximating traditional American or English character. See English-style India Pale Ale",50,70,6.3,7.5,6,14,1.06,1.012,1.018,2012-03-21 20:06:45,2015-04-07 15:26:37,,,,,,,,
295GZo,19 Original Colonies,19 Original Colonies,"19 Original Colonies Mead is brewed using 5 ingredients: Rogue Hopyard Honey, Wild Flower Honey, Jasmine Silver Tip Green Tea Leaves, Champagne Yeast & Free Range Coastal Water. No Chemicals, additives or preservatives were used.",5.5,,,,148,Y,https://s3.amazonaws.com/brewerydbapi/beer/295GZo/upload_8xSLPu-icon.png,https://s3.amazonaws.com/brewerydbapi/beer/295GZo/upload_8xSLPu-medium.png,https://s3.amazonaws.com/brewerydbapi/beer/295GZo/upload_8xSLPu-large.png,verified,Verified,1.008,2012-12-08 17:12:10,2015-12-16 20:28:23,,,,,,,148,12,12,"Mead, Cider, & Perry",2012-03-21 20:06:46,Open Category Mead,Mead,"This mead should exhibit the character of all of the ingredients in varying degrees, and should show a good blending or balance between the various flavor elements. Whatever ingredients are included, the result should be identifiable as a honey-based fermented beverage.",,,,,,,,,,2012-03-21 20:06:46,2015-04-07 15:48:35,,,,,,,,
2SPG7Z,19-33 Queens Lagrrr!,19-33 Queens Lagrrr!,"A modern golden Pilsner with a smooth, rounded mouthfeel and a hint of light caramel sweetness.  Bright, spicy nose that finishes with a grassy and prickly tart noble hop character from Saaz, Sladek and Hull Melon hops.",5.4,45,4,1,93,N,https://s3.amazonaws.com/brewerydbapi/beer/2SPG7Z/upload_Mf8wHF-icon.png,https://s3.amazonaws.com/brewerydbapi/beer/2SPG7Z/upload_Mf8wHF-medium.png,https://s3.amazonaws.com/brewerydbapi/beer/2SPG7Z/upload_Mf8wHF-large.png,verified,Verified,,2012-12-14 11:42:26,2015-12-16 22:54:41,4,Pilsner,2012-01-03 02:41:33,1,Year Round,Available year round as a staple beer.,93,8,8,North American Lager,2012-03-21 20:06:46,American-Style Lager,American Lager,"Light in body and very light to straw in color, American lagers are very clean and crisp and aggressively carbonated. Flavor components should b e subtle and complex, with no one ingredient dominating the others. Malt sweetness is light to mild. Corn, rice, or other grain or sugar adjuncts are often used. Hop bitterness, flavor and aroma are negligible to very light. Light fruity esters are acceptable. Chill haze and diacetyl should be absent.",5,13,3.8,5,2,4,1.04,1.006,1.01,2012-03-21 20:06:46,2015-04-07 15:39:26,,cold,Cold - (4-7C/39-45F),,,,,Hot spicy foods (Thai or Buffalo Wings) as well as fresh goat cheese or a classic cheese burger cheese burger cheese burger
VHOCgc,1900 Amber Lager,1900 Amber Lager,"German Melanoiden and Munich malts blend with Willamette hops to create this incredibly refreshing and completely satisfying lager. Bright, refreshing and skillfully balanced — an all purpose après activity brew.",4.7,31,5,3,101,N,https://s3.amazonaws.com/brewerydbapi/beer/VHOCgc/upload_CptSiz-icon.png,https://s3.amazonaws.com/brewerydbapi/beer/VHOCgc/upload_CptSiz-medium.png,https://s3.amazonaws.com/brewerydbapi/beer/VHOCgc/upload_CptSiz-large.png,verified,Verified,,2012-09-08 15:50:39,2015-12-16 18:28:59,5,Pint,2012-01-03 02:41:33,3,Not Available,Beer is not available.,101,8,8,North American Lager,2012-03-21 20:06:46,American-Style Amber Lager,American Amber Lager,"American-style amber lagers are light amber to amber or copper colored. They are medium bodied. There is a noticeable degree of caramel-type malt character in flavor and often in aroma. This is a broad category in which the hop bitterness, flavor, and aroma may be accentuated or may only be present at relatively low levels, yet noticeable. Fruity esters, diacetyl, and chill haze should be absent.",18,30,4.8,5.4,6,14,1.042,1.01,1.018,2012-03-21 20:06:46,2015-04-07 15:41:26,6,,,6,6,F8A600,,
AyZFSh,1901 Red Ale,1901 Red Ale,"This is not your standard Red Ale. This is a very ‘malty’, ‘roasty’ and complex Red Ale. The roasted flavor comes from the high presence of roasted barley. With a very minimal but high alpha hop addition, this Red Ale has become a favorite among patrons.",,,5,,22,N,https://s3.amazonaws.com/brewerydbapi/beer/AyZFSh/upload_eiOewm-icon.png,https://s3.amazonaws.com/brewerydbapi/beer/AyZFSh/upload_eiOewm-medium.png,https://s3.amazonaws.com/brewerydbapi/beer/AyZFSh/upload_eiOewm-large.png,verified,Verified,,2012-02-16 10:56:13,2015-12-16 14:33:53,5,Pint,2012-01-03 02:41:33,,,,22,2,2,Irish Origin Ales,2012-03-21 20:06:45,Irish-Style Red Ale,Irish Red,Irish-style red ales range from light red-amber-copper to light brown in color. These ales have a medium hop bitterness and flavor. They often don't have hop aroma. Irish-style red ales have low to medium candy-like caramel malt sweetness and may have a balanced subtle degree of roast barley or roast malt character and complexity.  Irish-style Red Ales have a medium body. The style may have low levels of fruity-ester flavor and aroma. Diacetyl should be absent or at very low levels. Chill haze is allowable at cold temperatures. Slight yeast haze is acceptable for bottle-conditioned products.,20,28,4,4.5,11,18,1.04,1.01,1.014,2012-03-21 20:06:45,2015-04-07 15:23:38,,,,,,,,
9wNKio,1916 Shore Shiver,1916 Shore Shiver,"Man Eating Sharks Infest the Atlantic!

In the summer of 1916, a shark haunted the New Jersey coastline killing four & injuring seven. While there is much debate over what shark was responsible, there is no question that the attacks found their way into pop books & films  depicting one great white shark who made the shore shiver.",6.9,,5,,30,N,https://s3.amazonaws.com/brewerydbapi/beer/9wNKio/upload_NaK1Fh-icon.png,https://s3.amazonaws.com/brewerydbapi/beer/9wNKio/upload_NaK1Fh-medium.png,https://s3.amazonaws.com/brewerydbapi/beer/9wNKio/upload_NaK1Fh-large.png,verified,Verified,,2014-06-03 11:51:34,2015-12-17 12:58:57,5,Pint,2012-01-03 02:41:33,,,,30,3,3,North American Origin Ales,2012-03-21 20:06:45,American-Style India Pale Ale,American IPA,"American-style India pale ales are perceived to have medium-high to intense hop bitterness, flavor and aroma with medium-high alcohol content. The style is further characterized by floral, fruity, citrus-like, piney, resinous, or sulfur-like American-variety hop character. Note that one or more of these American-variety hop characters is the perceived end, but the hop characters may be a result of the skillful use of hops of other national origins. The use of water with high mineral content results in a crisp, dry beer. This pale gold to deep copper-colored ale has a full, flowery hop aroma and may have a strong hop flavor (in addition to the perception of hop bitterness). India pale ales possess medium maltiness which contributes to a medium body. Fruity-ester flavors and aromas are moderate to very strong. Diacetyl can be absent or may be perceived at very low levels. Chill and/or hop haze is allowable at cold temperatures. (English and citrus-like American hops are considered enough of a distinction justifying separate American-style IPA and English-style IPA categories or subcategories. Hops of other origins may be used for bitterness or approximating traditional American or English character. See English-style India Pale Ale",50,70,6.3,7.5,6,14,1.06,1.012,1.018,2012-03-21 20:06:45,2015-04-07 15:26:37,,,,,,,,
